{
  "schemaVersion": "tf.backend-migration-admission/0.2",
  "baseCommit": "307e6d723086fe41b6d89e9f9b4b532364ccaeff",
  "previousLedgerDigest": "8468e45d34780f4d8118ed4b470c6764fd69e771ad2de3a95e2fe2faecb067a7",
  "historicalFiles": [
    {
      "path": "evaluation/backend-migration/r18a-origin-main-admission-v0.1.json",
      "mode": 420,
      "size": 511225,
      "sha256": "8468e45d34780f4d8118ed4b470c6764fd69e771ad2de3a95e2fe2faecb067a7"
    },
    {
      "path": "evaluation/reviews/2026-09-07-backend-migration-admission-v0.1-builder-gates.json",
      "mode": 420,
      "size": 7566,
      "sha256": "a8111ceae1ee6d93e08351243816ebbd6ecb7f32d62e477a409c3ccb034848d0"
    },
    {
      "path": "evaluation/reviews/2026-09-07-backend-migration-admission-v0.1-final-review.json",
      "mode": 420,
      "size": 81228,
      "sha256": "8ed096527bc1557a72fca40d0abce06726ca4a05c2936d2e26917243317231f7"
    },
    {
      "path": "evaluation/reviews/2026-09-07-backend-migration-admission-v0.1-preflight.json",
      "mode": 420,
      "size": 7584,
      "sha256": "b6c0848e7879b178d22793b5b5867e80dda697d8d290dd17975a950c29b82870"
    },
    {
      "path": "evaluation/reviews/2026-09-07-backend-migration-admission-v0.1-science-review.json",
      "mode": 420,
      "size": 5167,
      "sha256": "fec4967d3bcf6190fdd72c1475ef117f999d4f3705fdea68adf11f57820299b3"
    },
    {
      "path": "evaluation/reviews/2026-09-07-backend-migration-admission-v0.1-scope.md",
      "mode": 420,
      "size": 4806,
      "sha256": "bdc02711e4865ccd2a4a34dbb767b55eacfa004445d7e6c404f2df7eb1711b36"
    },
    {
      "path": "evaluation/reviews/2026-09-07-backend-migration-admission-v0.1-software-review.json",
      "mode": 420,
      "size": 6330,
      "sha256": "0574b040a44d8f6389b93c7c4b2eec5ae3bad59febc1354bcd643638584f4a4a"
    },
    {
      "path": "evaluation/reviews/2026-09-07-backend-migration-admission-v0.1-sota-review.json",
      "mode": 420,
      "size": 5705,
      "sha256": "24bd9072324f5104558372d026f678b2b411c7628cb5491dc6c79e0dfa87a81c"
    },
    {
      "path": "schemas/backend-migration-admission-v0.1.schema.json",
      "mode": 420,
      "size": 9241,
      "sha256": "6690812bec7ca8421460a2bd9b26c9eccf83cc98e6f4ff842c96f49e254f58fc"
    },
    {
      "path": "scripts/backend-migration/verify-r18a-origin-main-admission.mjs",
      "mode": 420,
      "size": 24876,
      "sha256": "df7c5eb2b55a38f4a162d5b6dd78cb2414e99bf10c3d2508216e010cc26308d0"
    },
    {
      "path": "scripts/backend-migration/verify-r18a-origin-main-admission.test.mjs",
      "mode": 420,
      "size": 15597,
      "sha256": "e7ecf1206801a69493c05b4335b65bf3c4f636095e7b77817b23ff21b61b3cba"
    }
  ],
  "imports": [
    {
      "path": "evaluation/mesoscale/dependencies/pfhub7a-r17b-cas/benchmark7-aa4774ce.ipynb",
      "mode": 420,
      "size": 90735,
      "sha256": "333c096923e9b1f882867f9ac0caeab21570ab817387e5c07fb9ff13077e3c1a"
    },
    {
      "path": "evaluation/mesoscale/dependencies/pfhub7a-r18a-fipy/runtime-lock-v1.json",
      "mode": 420,
      "size": 7411,
      "sha256": "cd7f8e8a47d67596c025a8035890e99f5a367be562289e84ae4f6d87e79c08ee"
    },
    {
      "path": "evaluation/mesoscale/fixtures/pfhub7a-r18a-independent-solver-preflight-v4-successor-v3-receipt.json",
      "mode": 292,
      "size": 248778,
      "sha256": "d91e31d261bf77f99b17e810f5f51aab131dd5339e281839933e45fa79855e5c"
    },
    {
      "path": "evaluation/mesoscale/preregistrations/pfhub7a-r18a-independent-solver-preflight-v4-resolved.json",
      "mode": 420,
      "size": 20908,
      "sha256": "7f2a5bb819f9ebdedd8eb038e8c3c924c3d547593793da374021e3c04869e253"
    },
    {
      "path": "schemas/pfhub7a-r18a-preflight-receipt-v0.3.schema.json",
      "mode": 420,
      "size": 36479,
      "sha256": "fa683c16fff2df87effdf4fa0d8b09bfcd0db51027868bde3702037ffeab0968"
    },
    {
      "path": "scripts/mesoscale/pfhub7a_r18a_oracle.py",
      "mode": 420,
      "size": 6966,
      "sha256": "32bf106747aa04015c91fea4ae9293961325f7d217b2a8560ab6d3a0c1656539"
    },
    {
      "path": "scripts/mesoscale/pfhub7a_r18a_preflight_v3_test.py",
      "mode": 420,
      "size": 18417,
      "sha256": "39d74e28460d45b39655754be2ec9328d41d6952f443cbf433117daa387542b3"
    },
    {
      "path": "scripts/mesoscale/pfhub7a_r18a_schema_gate_v3.mjs",
      "mode": 420,
      "size": 30418,
      "sha256": "0d5c9e6f877202b03c1dfa4ef0e089a295ee4b90ce734d2850f0725c97f85946"
    },
    {
      "path": "scripts/mesoscale/pfhub7a_r18a_schema_gate_v3.node-test.mjs",
      "mode": 420,
      "size": 16746,
      "sha256": "4eb343ea1dbd1a35bb7178f84eff6532ea25c57018dad06173ee608d422294e6"
    },
    {
      "path": "scripts/mesoscale/pfhub7a_r18a_supervise_v3.py",
      "mode": 420,
      "size": 72494,
      "sha256": "8d7f001b9cd2d865f62a4ce7ba9b70040b6544eeb7847f0afdcb2eaa66ca61af"
    },
    {
      "path": "scripts/mesoscale/pfhub7a_r18a_worker.py",
      "mode": 420,
      "size": 29719,
      "sha256": "3ad9a7c9d7ef6c968042acd7c365c2ef2e3ed049ecdb531240aa1d527f03568f"
    },
    {
      "path": "scripts/mesoscale/r16c_json_integrity.mjs",
      "mode": 420,
      "size": 8093,
      "sha256": "0067fd639b73d7f4aa4f6354c83258745fa7e0cb74c944f870df9db409ee9cc4"
    }
  ],
  "reconciled": [
    {
      "path": ".gitignore",
      "mode": 420,
      "size": 492,
      "sha256": "31341236431b683b0d8c229dc36c2a8aae2c511c63d067206752f3885ec8e395"
    },
    {
      "path": "package.json",
      "mode": 420,
      "size": 3066,
      "sha256": "b011cd48dd265511c16a080024dfb0b334954f66d93c548b1270f2aafe3916d4"
    },
    {
      "path": "vitest.config.ts",
      "mode": 420,
      "size": 1308,
      "sha256": "85669d13ea4f8403167f117319f5f11292cbb61839095f301b8d3aef6fc87a7e"
    }
  ],
  "additions": [
    {
      "path": "evaluation/mesoscale/dependencies/pfhub7a-r17b-cas/PFHub-LICENSE.md",
      "mode": 420,
      "size": 1754,
      "sha256": "9f5bda077de4182c0bd4fdbc2e1f64c1b6bc944c13802325093b00012fa95dba"
    },
    {
      "path": "evaluation/mesoscale/dependencies/pfhub7a-r17b-cas/pfhub7-source-provenance.json",
      "mode": 420,
      "size": 4303,
      "sha256": "6c54be73b7d65c0a2afc36790ecbcaabddf00449aac767056e21bbeb31011b17"
    },
    {
      "path": "evaluation/reviews/2026-09-07-r18a-current-main-execution-v0.1-scope.md",
      "mode": 420,
      "size": 8746,
      "sha256": "69d8b377350298c4d6ce62a4e9a981ce335feed1d957dd0ea8bb35111a1ad0d3"
    },
    {
      "path": "schemas/backend-migration-admission-v0.2.schema.json",
      "mode": 420,
      "size": 3202,
      "sha256": "df7a30e50f1608904dc793eddfca23069b6d78f9f1a29e50ac7a67fea4e27684"
    },
    {
      "path": "scripts/backend-migration/verify-r18a-origin-main-admission-v0.2.test.mjs",
      "mode": 420,
      "size": 4535,
      "sha256": "4b30c5cd29764d9dbf452485fbea30f68df843303f80f648575a96748b2b106e"
    },
    {
      "path": "scripts/mesoscale/pfhub7a_r18a_current_root.mjs",
      "mode": 420,
      "size": 18023,
      "sha256": "18847a164a2578d57a058a905db5c599650a86caf9ee574a60dbdb34ee5883e1"
    },
    {
      "path": "scripts/mesoscale/pfhub7a_r18a_current_root.test.mjs",
      "mode": 420,
      "size": 8756,
      "sha256": "4579efa98f0c4435a1609bcbfa38b828eb5090d936b8fa98e6666fca59836404"
    },
    {
      "path": "evaluation/reviews/2026-09-07-r18a-current-main-execution-v0.1-deadline-fix-scope.md",
      "mode": 420,
      "size": 4065,
      "sha256": "39e6ce7c29a7f16bfe3b11cae65fe1c7e75aeb2b38141d40d9ede50ba603161a"
    }
  ],
  "controlFiles": [
    "evaluation/backend-migration/r18a-origin-main-admission-v0.2.json",
    "scripts/backend-migration/verify-r18a-origin-main-admission-v0.2.mjs"
  ],
  "reviewOutputs": [
    "evaluation/reviews/2026-09-07-r18a-current-main-execution-v0.1-manifest.json",
    "evaluation/reviews/2026-09-07-r18a-current-main-execution-v0.1-builder-gates.json",
    "evaluation/reviews/2026-09-07-r18a-current-main-execution-v0.1-science-review.json",
    "evaluation/reviews/2026-09-07-r18a-current-main-execution-v0.1-software-review.json",
    "evaluation/reviews/2026-09-07-r18a-current-main-execution-v0.1-sota-review.json",
    "evaluation/reviews/2026-09-07-r18a-current-main-execution-v0.1-final-review.json",
    "evaluation/reviews/2026-09-07-r18a-current-main-execution-v0.1-successor-v2-manifest.json",
    "evaluation/reviews/2026-09-07-r18a-current-main-execution-v0.1-successor-v2-builder-gates.json"
  ],
  "claims": {
    "releaseEligible": false,
    "migrationComplete": false,
    "rightsCleared": false,
    "historicalApprovalTransferred": false,
    "convergenceVerified": false,
    "physicalValidation": false,
    "causalEffectIdentified": false,
    "scoreIncrease": false,
    "latestMainIntegrated": false
  },
  "counts": {
    "baseMain": 449,
    "mainPreserved": 446,
    "mainReconciled": 3,
    "importedLegacyOnly": 12,
    "pendingNonR12LegacyOnly": 469,
    "excludedR12": 9,
    "historicalConflicts": 45
  }
}
